{
  "id": "5d6e7f8a-9b0c-4d1e-8f2a-3b4c5d6e7f8a",
  "runner_id": "9a8b7c6d-5e4f-4a3b-8c2d-1e0f9a8b7c6d",
  "actor_id": "user-example",
  "runtime": "codex",
  "runtime_version": "0.48.0",
  "surface": "app_server",
  "origin": "launched",
  "control": "controllable",
  "runtime_session_id": "thr_example_01",
  "status": "failed",
  "workspace_id": "ws-example",
  "repo": "github.com/example/widgets",
  "branch": "agenomic/fix-123",
  "base_revision": "4e1d2c3b4a5968778695a4b3c2d1e0f9a8b7c6d5",
  "model": null,
  "policy_profile": "isolated_dev",
  "policy_refs": [
    "coding-isolated-dev@1.0.0"
  ],
  "mode_requested": "enforce",
  "mode_effective": "blocked",
  "protection": {
    "protected": [],
    "not_covered": [
      "coding.shell.exec",
      "coding.fs.write"
    ],
    "notes": [
      "Pre-tool control probe did not complete on this runtime version."
    ]
  },
  "limitations": [
    "Pre-tool control could not be validated on this runtime version; enforce refused."
  ],
  "pending_approvals": 0,
  "last_heartbeat_at": "2026-10-05T09:10:00Z",
  "connected_at": "2026-10-05T09:00:20Z",
  "created_at": "2026-10-05T09:00:00Z",
  "updated_at": "2026-10-05T09:10:00Z",
  "ended_at": null,
  "capture": {
    "conversation": true,
    "commands": true,
    "diffs": true,
    "outputs": false
  },
  "capabilities": {
    "pre_tool_control": {
      "announced": "supported_tested",
      "validated": "unknown"
    }
  }
}
