{
  "id": "7b8c9d0e-1f2a-4b3c-8d4e-5f6a7b8c9d0e",
  "runner_id": null,
  "runtime": "codex",
  "origin": "imported",
  "control": "imported",
  "runtime_session_id": "example-native-session",
  "status": "stopped",
  "mode_requested": "observe",
  "mode_effective": "none",
  "created_at": "2026-10-05T09:00:00Z"
}
