{
  "id": "4c5d6e7f-8a9b-4c0d-9e1f-2a3b4c5d6e7f",
  "runner_id": "9a8b7c6d-5e4f-4a3b-8c2d-1e0f9a8b7c6d",
  "actor_id": "user-example",
  "runtime": "codex",
  "runtime_version": "0.48.0",
  "surface": "app_server",
  "origin": "launched",
  "control": "controllable",
  "runtime_session_id": "thr_example_01",
  "status": "running",
  "workspace_id": "ws-example",
  "repo": "github.com/example/widgets",
  "branch": "agenomic/fix-123",
  "base_revision": "4e1d2c3b4a5968778695a4b3c2d1e0f9a8b7c6d5",
  "model": null,
  "policy_profile": "isolated_dev",
  "policy_refs": [
    "coding-isolated-dev@1.0.0"
  ],
  "mode_requested": "enforce",
  "mode_effective": "enforce",
  "protection": {
    "protected": [
      "coding.shell.exec",
      "coding.fs.write",
      "coding.git.push"
    ],
    "not_covered": [
      "coding.mcp.call"
    ],
    "notes": [
      "Shell, file and git calls are gated by the app-server approval hook.",
      "Commands run in the runtime's workspace-write sandbox."
    ]
  },
  "limitations": [
    "MCP tool calls are observed after execution only."
  ],
  "pending_approvals": 0,
  "last_heartbeat_at": "2026-10-05T09:10:00Z",
  "created_at": "2026-10-05T09:00:00Z",
  "updated_at": "2026-10-05T09:10:00Z",
  "ended_at": null,
  "capture": {
    "conversation": true,
    "commands": true,
    "diffs": true,
    "outputs": false
  },
  "capabilities": {
    "converse": {
      "announced": "supported_tested",
      "validated": "supported_tested"
    },
    "pre_tool_control": {
      "announced": "supported_tested",
      "validated": "supported_tested"
    }
  }
}
